{
  "$schema": "http://json-schema.org/draft-07/schema#",
  "title": "OrreryFragment",
  "type": "object",
  "required": ["pack", "elements"],
  "properties": {
    "pack": { "type": "string" },
    "elements": {
      "type": "array",
      "items": {
        "type": "object",
        "required": ["id", "kind", "title", "summary"],
        "properties": {
          "id": { "type": "string", "pattern": "^[a-z][a-z0-9_]*$" },
          "parent": { "type": ["string", "null"] },
          "kind": { "enum": ["system", "actor", "container", "component", "datastore", "queue", "external_service", "cloud_provider", "package", "tool", "file"] },
          "title": { "type": "string", "maxLength": 60 },
          "summary": { "type": "string", "maxLength": 200 },
          "description": { "type": "string", "maxLength": 2000 },
          "technology": { "type": "string" },
          "files": {
            "type": "array",
            "items": {
              "type": "object",
              "required": ["path"],
              "properties": {
                "path": { "type": "string", "pattern": "^[^/]" },
                "start_line": { "type": "integer", "minimum": 1 },
                "end_line": { "type": "integer", "minimum": 1 }
              }
            }
          },
          "external_url": { "type": ["string", "null"] },
          "tags": { "type": "array", "items": { "type": "string" } }
        }
      }
    },
    "relations": {
      "type": "array",
      "items": {
        "type": "object",
        "required": ["from", "to", "summary"],
        "properties": {
          "from": { "type": "string" },
          "to": { "type": "string" },
          "kind": { "enum": ["uses", "calls", "reads", "writes", "deploys_to", "depends_on", "triggers"] },
          "summary": { "type": "string", "maxLength": 200 }
        }
      }
    },
    "open_questions": { "type": "array", "items": { "type": "string" } }
  }
}
